<?xml version="1.0" encoding="UTF-8"?>
<xsd:schema xmlns:xsd="http://www.w3.org/2001/XMLSchema" 
	    targetNamespace="http://www.htc.org/application" 
	    xmlns="http://www.htc.org/application" 
	    elementFormDefault="qualified">

	<xsd:element name="application" type="ModulesType"/>
	
	<xsd:complexType name="ModulesType">
			<xsd:sequence>
				<xsd:element name="module" type="ModuleType" maxOccurs="unbounded"/>
			</xsd:sequence>
	</xsd:complexType>
	
	
	<xsd:complexType name="ModuleType">
		<xsd:sequence>
			<xsd:element name="menuitem1" type="xsd:string"/>
			<xsd:element name="menuitem2" type="xsd:string" />
		</xsd:sequence>
		<xsd:attribute name="name" type="xsd:ID" use="required"/>
	</xsd:complexType>	
	
</xsd:schema>