<?xml version="1.0" encoding="UTF-8"?>                                                                                                                                                                                                                              

<application xmlns="http://www.htc.org/application" 
       xmlns:ns="http://www.w3.org/2001/XMLSchema-instance" 
       ns:schemaLocation="http://www.htc.org/application application.xsd">

	<module name='Purchases'>
			<menuitem1>Purchase Order</menuitem1>
			<menuitem2>Purchase Returns</menuitem2>
	</module>
	
	
	<module name='Sales'>
			<menuitem1>Sales Order</menuitem1>
			<menuitem2>Sales Returns</menuitem2>
	</module>
	
	<module name='Finance'>
			<menuitem1>Payments</menuitem1>
			<menuitem2>Receivables</menuitem2>
	</module>
    
</application>